{
  "schema_version": "wp8-feasibility-registration-v1",
  "manifest_sha256": "029d28e1098171cfea2996db22bb6f654f2ec699b3fd61fd718f3c128288aef0",
  "dataset_selection_sha256": "25917e759fc3b7ac66809c935b15243f8342f4d948faf389029fed35b05d0528",
  "preregistration_sha256": "e189e8fcbf7517c4d5e45ae3a81e14e781382da7a426d2114c34619d201f3b1c",
  "methods": {
    "gravity": {
      "dataset_slug": "USGS_SierraNevada_gravity_magnetic_grids_2024",
      "license_evidence": {
        "passed": true,
        "statement": "This work is marked with Creative Commons Zero v1.0 Universal (https://creativecommons.org/publicdomain/zero/1.0/). ",
        "evidence_path": "00_catalog/open_geophysics_data_manifest.json",
        "evidence_sha256": "029d28e1098171cfea2996db22bb6f654f2ec699b3fd61fd718f3c128288aef0"
      },
      "gates": {
        "license": {
          "method": "gravity",
          "dataset_slug": "USGS_SierraNevada_gravity_magnetic_grids_2024",
          "gate_name": "license",
          "status": "passed",
          "reason": "This work is marked with Creative Commons Zero v1.0 Universal (https://creativecommons.org/publicdomain/zero/1.0/). ",
          "producer": "src/geodeepbayes/validation/feasibility.py",
          "producer_sha256": "487bc66a28b565f5579e85fffaf0a219e369335adbd5b0a2bd946112ae1f7a86",
          "measurements": {
            "affirmative_gate": true
          },
          "thresholds": {
            "required_status": "passed"
          },
          "evidence_id": "wp8-gravity-license-0e750a3a597f8e1f",
          "evidence_sha256": "0e750a3a597f8e1f3ac3d822fad7ba2cc0efdaded862e619d1dcdf73b452954d"
        },
        "integrity": {
          "method": "gravity",
          "dataset_slug": "USGS_SierraNevada_gravity_magnetic_grids_2024",
          "gate_name": "integrity",
          "status": "passed",
          "reason": "all selected top-level members match manifest",
          "producer": "src/geodeepbayes/validation/feasibility.py",
          "producer_sha256": "487bc66a28b565f5579e85fffaf0a219e369335adbd5b0a2bd946112ae1f7a86",
          "measurements": {
            "affirmative_gate": true
          },
          "thresholds": {
            "required_status": "passed"
          },
          "evidence_id": "wp8-gravity-integrity-c1ecb76c134ee562",
          "evidence_sha256": "c1ecb76c134ee562ea2c8043bc74092a09d1b18b72436fd834163f18758d97b4"
        },
        "observation_contract": {
          "method": "gravity",
          "dataset_slug": "USGS_SierraNevada_gravity_magnetic_grids_2024",
          "gate_name": "observation_contract",
          "status": "passed",
          "reason": "GA national pool supplies spherical-cap Bouguer plus Bullard-C terrain correction and pointwise propagated uncertainty; all 53,066 interpreted training rows satisfy the frozen contract",
          "producer": "src/geodeepbayes/validation/feasibility.py",
          "producer_sha256": "487bc66a28b565f5579e85fffaf0a219e369335adbd5b0a2bd946112ae1f7a86",
          "measurements": {
            "affirmative_gate": true
          },
          "thresholds": {
            "required_status": "passed"
          },
          "evidence_id": "wp8-gravity-observation_contract-5152dbb98c0113fb",
          "evidence_sha256": "5152dbb98c0113fbaffd7dfe421821fd637908d330066fea2f613365dd8f9e5f"
        },
        "clusters": {
          "method": "gravity",
          "dataset_slug": "USGS_SierraNevada_gravity_magnetic_grids_2024",
          "gate_name": "clusters",
          "status": "passed",
          "reason": "GA training-only range is 12.5 km; one-unit-per-provider and train/calibration plus pairwise spatial separation retain 261 sealed independent test surveys",
          "producer": "src/geodeepbayes/validation/feasibility.py",
          "producer_sha256": "487bc66a28b565f5579e85fffaf0a219e369335adbd5b0a2bd946112ae1f7a86",
          "measurements": {
            "affirmative_gate": true
          },
          "thresholds": {
            "required_status": "passed"
          },
          "evidence_id": "wp8-gravity-clusters-42967969569781a7",
          "evidence_sha256": "42967969569781a70dcf1c4424172a4527387e4057c0bcd9fb94539a0291f3f4"
        },
        "power": {
          "method": "gravity",
          "dataset_slug": "USGS_SierraNevada_gravity_magnetic_grids_2024",
          "gate_name": "power",
          "status": "passed",
          "reason": "training-block paired-CRPS dispersion requires 153 clusters for a 10% improvement; coverage equivalence requires 223 and 261 remain",
          "producer": "src/geodeepbayes/validation/feasibility.py",
          "producer_sha256": "487bc66a28b565f5579e85fffaf0a219e369335adbd5b0a2bd946112ae1f7a86",
          "measurements": {
            "affirmative_gate": true
          },
          "thresholds": {
            "required_status": "passed"
          },
          "evidence_id": "wp8-gravity-power-615e3014c243fc1f",
          "evidence_sha256": "615e3014c243fc1f477d3263ad80bd3f3eb3c24f881462d5efd1a1d317766e0e"
        },
        "dimensionality": {
          "method": "gravity",
          "dataset_slug": "USGS_SierraNevada_gravity_magnetic_grids_2024",
          "gate_name": "dimensionality",
          "status": "passed",
          "reason": "training-only regional detrending and variograms select mandatory 3-D for both statewide and continental station coverage",
          "producer": "src/geodeepbayes/validation/feasibility.py",
          "producer_sha256": "487bc66a28b565f5579e85fffaf0a219e369335adbd5b0a2bd946112ae1f7a86",
          "measurements": {
            "affirmative_gate": true
          },
          "thresholds": {
            "required_status": "passed"
          },
          "evidence_id": "wp8-gravity-dimensionality-3c491428152b7b3d",
          "evidence_sha256": "3c491428152b7b3ddaa7e947f09134411e70c033f5da8bdb37faf92fd0ea9cc8"
        },
        "solver": {
          "method": "gravity",
          "dataset_slug": "USGS_SierraNevada_gravity_magnetic_grids_2024",
          "gate_name": "solver",
          "status": "passed",
          "reason": "versioned GravityOperator path frozen for 3-D rectangular-prism volume integration",
          "producer": "src/geodeepbayes/validation/feasibility.py",
          "producer_sha256": "487bc66a28b565f5579e85fffaf0a219e369335adbd5b0a2bd946112ae1f7a86",
          "measurements": {
            "affirmative_gate": true
          },
          "thresholds": {
            "required_status": "passed"
          },
          "evidence_id": "wp8-gravity-solver-417b6a11ec10df86",
          "evidence_sha256": "417b6a11ec10df86da6c67f171def0e86c5484854e7fc91331647b00749db893"
        },
        "independent_reference": {
          "method": "gravity",
          "dataset_slug": "USGS_SierraNevada_gravity_magnetic_grids_2024",
          "gate_name": "independent_reference",
          "status": "passed",
          "reason": "gz for a finite rectangular prism with explicit SI-to-mGal conversion matches an independent Geoana implementation; derivative tests passed with protected source hash",
          "producer": "src/geodeepbayes/validation/feasibility.py",
          "producer_sha256": "487bc66a28b565f5579e85fffaf0a219e369335adbd5b0a2bd946112ae1f7a86",
          "measurements": {
            "affirmative_gate": true
          },
          "thresholds": {
            "required_status": "passed"
          },
          "evidence_id": "wp8-gravity-independent_reference-ae0b0e929c46ce5c",
          "evidence_sha256": "ae0b0e929c46ce5c48d979ee895d2c3e90068a2091308b52f0d693cd5674f15e"
        },
        "resource_budget": {
          "method": "gravity",
          "dataset_slug": "USGS_SierraNevada_gravity_magnetic_grids_2024",
          "gate_name": "resource_budget",
          "status": "passed",
          "reason": "three representative meshes measured; abort limits frozen at 5.0 s and 67108864 bytes",
          "producer": "src/geodeepbayes/validation/feasibility.py",
          "producer_sha256": "487bc66a28b565f5579e85fffaf0a219e369335adbd5b0a2bd946112ae1f7a86",
          "measurements": {
            "affirmative_gate": true
          },
          "thresholds": {
            "required_status": "passed"
          },
          "evidence_id": "wp8-gravity-resource_budget-c2b05265a8e881c6",
          "evidence_sha256": "c2b05265a8e881c6b5b805fd54535b98482acc745baab3717475d8a1c92c1960"
        }
      }
    },
    "magnetic": {
      "dataset_slug": "USGS_MountainPass_airborne_magnetic_2020",
      "license_evidence": {
        "passed": true,
        "statement": "FGDC access_constraints=None. Please see 'Distribution Info' for details.; use_constraints=None. There is no guarantee concerning the accuracy of the data. Any user who modifies the data is obligated to describe the types of modifications they perform. Data have been checked to ensure their accuracy. If any errors are detected, please notify the originating office. The U.S. Geological Survey strongly recommends that careful attention be paid to the metadata file associated with these data. Acknowledgment of the U.S. Geological Survey would be appreciated in products derived from these data. User specifically agrees not to misrepresent the data, nor to imply that changes made were approved or endorsed by the U.S. Geological Survey. Please refer to http://www.usgs.gov/privacy.html for the USGS disclaimer.",
        "evidence_path": "magnetic/USGS_MountainPass_airborne_magnetic_2020/Metadata.xml",
        "evidence_sha256": "b74d526ee062b63230afbb6730867b8b1c9f249b47ac4a6ed6c19039375d9dc3"
      },
      "gates": {
        "license": {
          "method": "magnetic",
          "dataset_slug": "USGS_MountainPass_airborne_magnetic_2020",
          "gate_name": "license",
          "status": "passed",